"A Vision for the Next Generation Platform-as-a-Service","S. Van Rossem; B. Sayadi; L. Roullet; A. Mimidis; M. Paolino; P. Veitch; B. Berde; I. Labrador; A. Ramos; W. Tavernier; E. Ollora; J. Soler",Ghent University-imec; Nokia Bell-Labs France; Nokia Bell-Labs France; DTU Fotonik; Virtual Open Systems; BT; Nokia Bell-Labs France; ATOS; ATOS; Ghent University-imec; DTU Fotonik; DTU Fotonik,"2018 IEEE 5G World Forum (5GWF)","1 Nov 2018","2018","","","14","19","In an increasingly interconnected world, new opportunities for telecom-based services are emerging. Innovative applications profit from cloud versatility and scalability, but require a platform to combine the optimized 5G network fabric with the advancements in the domain of cloud computing, Software Defined Networking (SDN) and Network Function Virtualization (NFV). In this multi-domain context, we find that available service platforms are lagging, because they tend to be tightly coupled to a constrained set of technologies. In practice, we need the flexibility to deploy different microservices over a heterogeneous range of infrastructure types, aggregating various virtualization, orchestration and control mechanisms. Moreover, the integration of the service requires collaboration among a wide mix of actors (e.g. developers, operators, hardware/software vendors, infrastructure/service providers or vertical integrators). We propose a next-generation Platform-as-a-Service (NGPaaS), devised as a modular framework for the development and operation of network services, while targeting a high degree of both customization and automation. The presented architecture is built around a workflow-based orchestrator which coordinates custom-built tasks across a tailored group of specialized infrastructure or platforms. We also explain how NGPaaS enhances DevOps-principles, to achieve a more efficient integration process across the many isolated administrative domains in the modern telco landscape.","","978-1-5386-4982-4","10.1109/5GWF.2018.8516972","","https://ieeexplore.ieee.org/stamp/stamp.jsp?arnumber=8516972","NFV;SDN;5G;PaaS Architecture;DevOps;Dev-for-Operations","Cloud computing;5G mobile communication;Virtualization;Computer architecture;Containers;Field programmable gate arrays;Next generation networking","cloud computing;service-oriented architecture;software defined networking;virtualisation;Web services","telecom-based services;cloud versatility;optimized 5G network fabric;cloud computing;Software Defined Networking;Network Function Virtualization;multidomain context;available service platforms;heterogeneous range;control mechanisms;hardware/software vendors;infrastructure/service providers;vertical integrators;next-generation Platform-as-a-Service;NGPaaS;network services;workflow-based orchestrator;custom-built tasks;specialized infrastructure;efficient integration process;isolated administrative domains;microservices","","6","","18","","1 Nov 2018","","","IEEE","IEEE Conferences"
"Optimizing Quality-Aware Big Data Applications in the Cloud","E. Gianniti; M. Ciavotta; D. Ardagna","Politecnico di Milano, Milan, Italy; Università di Milano-Bicocca, Milan, Italy; Politecnico di Milano, Milan, Italy","IEEE Transactions on Cloud Computing","4 Jun 2021","2021","9","2","737","752","The last years witnessed a steep rise in data generation worldwide and, consequently, the widespread adoption of software solutions able to support data-intensive application. Competitiveness and innovation have strongly benefited from these new platforms and methodologies, and there is a great deal of interest around the new possibilities that Big Data analytics promise to make reality. Many companies currently engage in data-intensive processes as part of their core businesses; however, fully embracing the data-driven paradigm is still cumbersome, and establishing a production-ready, fine-tuned deployment is time-consuming, expensive, and resource-intensive. This situation calls for innovative models and techniques to streamline the process of deployment configuration for Big Data applications. In particular, the focus in this paper is on the rightsizing of Cloud deployed clusters, which represent a cost-effective alternative to installation on premises. This paper proposes a novel tool, integrated in a wider DevOps-inspired approach, implementing a parallel and distributed simulation-optimization technique that efficiently and effectively explores the space of alternative Cloud configurations, seeking the minimum cost deployment that satisfies quality of service constraints. The soundness of the proposed solution has been thoroughly validated in a vast experimental campaign encompassing different applications and Big Data platforms.","2168-7161","","10.1109/TCC.2018.2874944","European Commission(grant numbers:644869); Microsoft; ","https://ieeexplore.ieee.org/stamp/stamp.jsp?arnumber=8486649","Nonlinear programming;performance of systems;distributed systems","Cloud computing;Big Data;Tools;Optimization;Unified modeling language;Biological system modeling;Data models","Big Data;cloud computing;data analysis;optimisation","innovative models;deployment configuration;Big Data applications;wider DevOps-inspired approach;parallel distributed simulation-optimization technique;alternative Cloud configurations;minimum cost deployment;Big Data platforms;optimizing quality-aware;steep rise;data generation worldwide;software solutions;data-intensive application;innovation;Big Data analytics;data-intensive processes;core businesses;data-driven paradigm;production-ready;fine-tuned deployment;resource-intensive","","2","","56","IEEE","9 Oct 2018","","","IEEE","IEEE Journals"
"Efficient Software Defined Systems Using Common Core Components","H. Lee; G. C. Fox","Sch. of Inf. & Comput., Indiana Univ., Bloomington, IN, USA; Sch. of Inf. & Comput., Indiana Univ., Bloomington, IN, USA","2017 IEEE 10th International Conference on Cloud Computing (CLOUD)","11 Sep 2017","2017","","","407","414","With advent of Docker containers, an application deployment using container images gains popularity over scientific communities and major cloud providers to ease building reproducible environments. While a single base image can be imported multiple times from different containers to reduce storage consumption by a sharing technique, copy-on-write, duplicates of package dependencies are often observed over containers. In this paper, we propose new approaches to the container image management for eliminating duplicated dependencies. We create Common Core Components (3C) to share package dependencies by version control system commands, submodules and merge. 3C with submodules provides a collection of required libraries and tools in a separate branch, while keeping their base image same. 3C with merge offers a new base image including domain specific components thereby reducing duplicates in similar base images. Container images built with 3C enable efficient and compact software defined systems and disclose security information for tracking Common Vulnerability and Exposure (CVE). As a result, building application environments with 3C-enabled container images consumes less storage compared to existing Docker images. Dependency information for vulnerability is provided in detail for further developments.","2159-6190","978-1-5386-1993-3","10.1109/CLOUD.2017.59","","https://ieeexplore.ieee.org/stamp/stamp.jsp?arnumber=8030615","Software Defined Systems;Common Core Components;Containers;DevOps;Dependencies","Containers;Libraries;Tools;Buildings;Software packages;Big Data","cloud computing;information storage;public domain software;security of data;software packages","Common Core Components;Docker containers;cloud providers;single base image;sharing technique;package dependencies;container image management;version control system commands;compact software defined systems;application environments;3C-enabled container images;dependency information;copy-on-write;software defined systems;Common Vulnerability and Exposure tracking;CVE tracking;Docker images;security information","","","1","23","","11 Sep 2017","","","IEEE","IEEE Conferences"
"Process-Oriented Non-intrusive Recovery for Sporadic Operations on Cloud","M. Fu; L. Zhu; I. Weber; L. Bass; A. Liu; X. Xu","NICTA, Sydney, NSW, Australia; NICTA, Sydney, NSW, Australia; NICTA, Sydney, NSW, Australia; NICTA, Sydney, NSW, Australia; NICTA, Sydney, NSW, Australia; NICTA, Sydney, NSW, Australia","2016 46th Annual IEEE/IFIP International Conference on Dependable Systems and Networks (DSN)","3 Oct 2016","2016","","","85","96","Cloud-based systems get changed more frequently than traditional systems. These frequent changes involve sporadic operations such as installation and upgrade. Sporadic operations may fail due to the uncertainty of cloud platforms. Each sporadic operation manipulates a number of cloud resources. The accessibility of resources manipulated makes it possible to build an accurate process model of the correct behavior for an operation and its desired effects. This paper proposes a non-intrusive recovery approach for sporadic operations on cloud, called POD-Recovery. POD-Recovery utilizes the above-mentioned process model of the operation. When needed, it triggers recovery actions based on the model through non-intrusive means, i.e., without modifying the code which implements the sporadic operation. POD-Recovery employs an efficient artificial intelligence (AI) planning technique for generating recovery plans. We implement POD-Recovery and evaluate it by recovering from faults injected into 920 runs of five representative sporadic operations.","2158-3927","978-1-4673-8891-7","10.1109/DSN.2016.17","","https://ieeexplore.ieee.org/stamp/stamp.jsp?arnumber=7579732","Software Reliability;Cloud;Non-Intrusive Recovery;Log Analysis;DevOps","Cloud computing;Runtime;Artificial intelligence;Monitoring;Virtual machining;Training;Australia","cloud computing;planning (artificial intelligence);resource allocation;software fault tolerance;system recovery","process-oriented nonintrusive recovery;sporadic operation;cloud-based system;resource manipulation;process model;POD-Recovery;artificial intelligence;AI planning technique;fault injection","","1","1","37","","3 Oct 2016","","","IEEE","IEEE Conferences"
"Adopting Continuous Integeration and Continuous Delivery for Small Teams","M. K. A. Abbass; R. I. E. Osman; A. M. H. Mohammed; M. W. A. Alshaikh","Sudan University of Science and Technology,College of Computer Science and Information Technology,Khartoum,Sudan; Sudan University of Science and Technology,College of Computer Science and Information Technology,Khartoum,Sudan; Sudan University of Science and Technology,College of Computer Science and Information Technology,Khartoum,Sudan; Sudan University of Science and Technology,College of Computer Science and Information Technology,Khartoum,Sudan","2019 International Conference on Computer, Control, Electrical, and Electronics Engineering (ICCCEEE)","20 Apr 2020","2019","","","1","4","Continuous Integration is the practice of merging small code changes frequently rather than merging large number changes at the end of a development cycle. In addition, after each integration, the system should be re-built and re-tested to ensure that the system is still working after each change, and it's safe to build on top of it. Continuous delivery is software practice in which the software can be deployed to the market at any given time. Developing continuous integration and continuous delivery platform will solve a lot of problems in old agile methods such as increases time to find and fix bugs as testing process late, deploying software that has not been fully tested and shared testing resources which cases delivery delays, when multiple projects are ready for testing one project get tested and others are queued waiting for the testing resource to be released. Also continuous delivery guides development organization to build valuable software and to increase the number of releases. With all this benefits there are some problem obstructing companies from moving to the new platform, some of them are human factors such as human resistant to changes and other are technical such as moving to new platform require learning new tools and training. To help overcome these problems we need to develop simple platform which is more usable and easy to learn. Also some problems happen when applying CI/CD some of them related to testing and others related to integration. Testing problem are: ambiguous test result which is test results that doesn't guided the developers to finds bugs, which increases time to find and fix it; time consuming tests which require developers to waiting large amount of time for testing reports after each small changes, this waiting cause the developers to practice large commit (merging large number of changes) which slows the integration process. Slow integration mean large number of conflict lines, now instead of doing productive process developers wasting time to solve this conflicts. To overcome these problem we introduce a new way to configuring tests. As you see solving time consumes test will solve integrations problems. To reduce testing time we need to organize the test in such way that tests are more appointed and targeted to changed code only. This method enforces a concept called micro-pipeline. A micro-pipeline is group of testing blocks, each block is responsible for specific type of test for specific unit of code, connected together in such a way that passing the block tests triggers the next test block in series. When integration happen the developer specify test block which is responsible for testing made changes only. The idea behind micro-pipeline is to test affected part only.","","978-1-7281-1006-6","10.1109/ICCCEEE46830.2019.9070849","","https://ieeexplore.ieee.org/stamp/stamp.jsp?arnumber=9070849","DevOps;Continuous Integration;Continuous Delivery","Testing;Software;Companies;Computer bugs;Reliability;Computer science;Information technology","program testing;resource allocation;software maintenance;software prototyping","code changes;software development cycle;continuous delivery platform;shared testing resources;block tests;continuous integration platform;micropipeline concept","","1","","8","","20 Apr 2020","","","IEEE","IEEE Conferences"
"Microservices in Industry: Insights into Technologies, Characteristics, and Software Quality","J. Bogner; J. Fritzsch; S. Wagner; A. Zimmermann","University of Stuttgart, Germany; University of Stuttgart, Germany; University of Stuttgart, Germany; University of Applied Sciences, Reutlingen, Germany","2019 IEEE International Conference on Software Architecture Companion (ICSA-C)","13 May 2019","2019","","","187","195","Microservices are a topic driven mainly by practitioners and academia is only starting to investigate them. Hence, there is no clear picture of the usage of Microservices in practice. In this paper, we contribute a qualitative study with insights into industry adoption and implementation of Microservices. Contrary to existing quantitative studies, we conducted interviews to gain a more in-depth understanding of the current state of practice. During 17 interviews with software professionals from 10 companies, we analyzed 14 service-based systems. The interviews focused on applied technologies, Microservices characteristics, and the perceived influence on software quality. We found that companies generally rely on well-established technologies for service implementation, communication, and deployment. Most systems, however, did not exhibit a high degree of technological diversity as commonly expected with Microservices. Decentralization and product character were different for systems built for external customers. Applied DevOps practices and automation were still on a mediocre level and only very few companies strictly followed the you build it, you run it principle. The impact of Microservices on software quality was mainly rated as positive. While maintainability received the most positive mentions, some major issues were associated with security. We present a description of each case and summarize the most important findings of companies across different domains and sizes. Researchers may build upon our findings and take them into account when designing industry-focused methods.","","978-1-7281-1876-5","10.1109/ICSA-C.2019.00041","","https://ieeexplore.ieee.org/stamp/stamp.jsp?arnumber=8712375","Microservices;industry;interviews;service technology;software quality","Java;Interviews;Companies;Cloud computing;Industries;Software quality","service-oriented architecture;software development management;software maintenance;software quality","software quality;software professionals;service-based systems;microservices;DevOps practices;maintainability;service-oriented computing;service-oriented architecture","","16","","16","","13 May 2019","","","IEEE","IEEE Conferences"
"Enhancing security of Docker using Linux hardening techniques","Amith Raj MP; A. Kumar; S. J. Pai; A. Gopal","Information Science and Engineering, Dayananda Sagar College of Engineering, Bengaluru, India; Information Science and Engineering, Dayananda Sagar College of Engineering, Bengaluru, India; Computer Science and Engineering, Dayananda Sagar College of Engineering, Bengaluru, India; Information Science and Engineering, Dayananda Sagar College of Engineering, Bengaluru, India","2016 2nd International Conference on Applied and Theoretical Computing and Communication Technology (iCATccT)","27 Apr 2017","2016","","","94","99","Docker which is a lightweight containerization tool has enabled DevOps to build and run applications in distributed environment effectively. Docker has generated a significant momentum by bringing together a standardized containing method which is easy to use by enabling the users to use Linux containers to its full capacity. Docker currently supports the Linux hardening capabilities and Linux Security Modules (LSM) with AppArmor and SELinux for host system hardening. Docker interacts with the kernel security systems and LSMs. In this research work, the security depth of a popular open source model based on containers and study on other security features and techniques to enhance the security of Docker is performed. Integrating virtualization, automated testing, Deployment tools and security configurations management will enhance the security capability of Docker on premise.","","978-1-5090-2399-8","10.1109/ICATCCT.2016.7911971","","https://ieeexplore.ieee.org/stamp/stamp.jsp?arnumber=7911971","Docker;LSM;Selinux;Apparmor;Security","Containers;Security;Linux;Kernel;File systems;Virtual machining;Virtualization","distributed processing;Linux;operating system kernels;security of data;software tools;virtualisation","Docker security enhancement;Linux hardening techniques;lightweight containerization tool;DevOps;distributed environment;standardized containing method;Linux containers;Linux security modules;LSM;AppArmor;SELinux;host system hardening;kernel security systems;virtualization;automated testing;security configurations management;deployment tools","","4","1","31","","27 Apr 2017","","","IEEE","IEEE Conferences"
"Continuous Security Testing: A Case Study on Integrating Dynamic Security Testing Tools in CI/CD Pipelines","T. Rangnau; R. v. Buijtenen; F. Fransen; F. Turkmen",University of Groningen; University of Groningen; TNO; University of Groningen,"2020 IEEE 24th International Enterprise Distributed Object Computing Conference (EDOC)","23 Oct 2020","2020","","","145","154","Continuous Integration (CI) and Continuous Delivery (CD) have become a well-known practice in DevOps to ensure fast delivery of new features. This is achieved by automatically testing and releasing new software versions, e.g. multiple times per day. However, classical security management techniques cannot keep up with this quick Software Development Life Cycle (SDLC). Nonetheless, guaranteeing high security quality of software systems has become increasingly important. The new trend of DevSecOps aims to integrate security techniques into existing DevOps practices. Especially, the automation of security testing is an important area of research in this trend. Although plenty of literature discusses security testing and CI/CD practices, only a few deal with both topics together. Additionally, most of the existing works cover only static code analysis and neglect dynamic testing methods. In this paper, we present an approach to integrate three automated dynamic testing techniques into a CI/CD pipeline and provide an empirical analysis of the introduced overhead. We then go on to identify unique research/technology challenges the DevSecOps communities will face and propose preliminary solutions to these challenges. Our findings will enable informed decisions when employing DevSecOps practices in agile enterprise applications engineering processes and enterprise security.","2325-6362","978-1-7281-6473-1","10.1109/EDOC49727.2020.00026","","https://ieeexplore.ieee.org/stamp/stamp.jsp?arnumber=9233212","DevSecOps;Dynamic Security Web Testing;Continuous Security;Continuous Integration","Security;Testing;Pipelines;Synthetic aperture sonar;Automation;Application security;Tools","program testing;security of data;software development management;software quality","software development life cycle;continuous security testing;dynamic security testing tools;CI;CD;DevOps practices;continuous integration;continuous delivery","","3","","23","","23 Oct 2020","","","IEEE","IEEE Conferences"
"An Empirical Study on Culture, Automation, Measurement, and Sharing of DevSecOps","N. Tomas; J. Li; H. Huang","Norwegian University of Science and Technology, Trondheim, Norway; Norwegian University of Science and Technology, Trondheim, Norway; Software Institute and Department of Computer Science, Nanjing University, Nanjing, China","2019 International Conference on Cyber Security and Protection of Digital Services (Cyber Security)","31 Oct 2019","2019","","","1","8","Programmers are central agents in creating secure applications. However, software engineering and software security have historically worked in separate silos. DevSecOps is the practice of breaking down silos between development, operations, and quality assurance of security. To understand the state of art and challenges of DevSecOps, we interviewed six developers about their DevSecOps practices. We asked interview subjects about their security practices rooted in the four pillars of DevOps, namely culture, automation, sharing, and measurement. Results were analyzed by using qualitative methods. The results of the study show that it is necessary first to create a security culture. Several interviewees identified the importance of caring about security and issues in existing culture, such as how developers feel attacked by security engineers if they create vulnerable code. After establishing a security culture in the organization, development and operations need the necessary training and knowledge so that security automation tools can be utilized effectively. Measurements need to be applied continuously to keep track of identified vulnerabilities, the amount of training staff has received, and staffs general opinions regarding security.","","978-1-7281-0229-0","10.1109/CyberSecPODS.2019.8884935","","https://ieeexplore.ieee.org/stamp/stamp.jsp?arnumber=8884935","DevOps;Security;Culture;Automation;Measurements;Sharing","Security;Companies;Tools;Software;Automation;Interviews;Training","personnel;security of data;software engineering","central agents;secure applications;software engineering;software security;DevSecOps practices;security practices;security culture;security automation tools","","18","","20","","31 Oct 2019","","","IEEE","IEEE Conferences"
