"Landscape of Monitoring and Visualization of Technologies in DevOps for Classification and Prediction","A. Pailwan; J. Abraham; M. Saraf","College of Engineering Pune,Computer Department,Pune,India; Computer Engineering College of Engineering Pune,Pune,India; Reliance Industries Limited,Navi Mumbai,India","2020 Fourth World Conference on Smart Trends in Systems, Security and Sustainability (WorldS4)","1 Oct 2020","2020","","","581","588","As Isaac Asimov said “If knowledge can create problems then it is not through ignorance that this, we solve them” which is the main motto for this project. This project wanted to create the central platform where the knowledge could be shared and keeping the saying in mind this project used logs for the research. Despite the logs are created for every instance and applications, studying and using them is rarely done because of their illegibility for people who do not understand that specific application's log profile leading to the use of logs either entirely neglected or rarely used for specific cases. This project is separated into 3 sections : 1) A centralised platform where the logs are stored and manipulated and standardised method for reading them is created using Elasticsearch. 2) Visualisation with the help of kibana is done for interpreting data. 3) Logs are ingested into hadoop eco system from logstash. From logstatsh which increase the retention time period of logs and hense machine learning algorithms for detecting anomaly in the logs can be done easily. This project tries to create a fully encompasing and logterm architectural solution for application managemnet of environments. And a broad perspective solution for visualizing flow of data on a mangeral level.","","978-1-7281-6823-4","10.1109/WorldS450073.2020.9210398","","https://ieeexplore.ieee.org/stamp/stamp.jsp?arnumber=9210398","Elasticsearch;Logstash;Kibana;Isolation Forest;Local Outer Factor;Elliptic Envelop;Hadoop;Druid;PySpark;Ruby","Data visualization;Servers;Monitoring;Data mining;Task analysis;Real-time systems;Forestry","application program interfaces;data handling;data visualisation;learning (artificial intelligence);parallel processing;pattern classification;system monitoring","technologies monitoring;technologies visualization;Elasticsearch;Kibana;Hadoop ecosystem;machine learning algorithms;devops","","","","17","","1 Oct 2020","","","IEEE","IEEE Conferences"
"How Do Students Feel About Automated Security Static Analysis Exercises?","A. Rahman; H. Shahriar; D. B. Bose","Tennessee Technological University,Department of Computer Science,Cookeville,TN,USA; Kennessaw State University,College of Computing and Software Engineering,Kennessaw,Georgia,USA; Reeve Systems,Dhaka,Bangladesh","2021 IEEE Frontiers in Education Conference (FIE)","20 Dec 2021","2021","","","1","4","This Innovative Practice, work in progress (WIP) paper presents our experience related to two exercises that focus on automated security static analysis, a practice used to integrate security into development and operations (DevOps). The concept has gained popularity amongst information technology (IT) organizations. However, security-related concerns, such as security weaknesses in DevOps artifacts can cause serious consequences. Our preliminary findings indicate that (i) students positively perceive the introduced exercises; and (ii) the students perform well if they are provided necessary background on the exercises. Our WIP paper lays the groundwork to build course materials that will facilitate development, deployment, and dissemination of DevOps-related education materials that also incorporate cybersecurity concepts.","2377-634X","978-1-6654-3851-3","10.1109/FIE49875.2021.9637201","National Science Foundation (NSF)(grant numbers:2026869); ","https://ieeexplore.ieee.org/stamp/stamp.jsp?arnumber=9637201","computer science;cybersecurity;devops;devsec-ops;education;exercise;experience report;student perception","Conferences;Static analysis;Organizations;Computer security;Information technology","cloud computing;computer aided instruction;computer science education;educational courses;program diagnostics;security of data;software tools","DevOps-related education materials;automated security static analysis exercises;information technology;security-related concerns","","","","14","IEEE","20 Dec 2021","","","IEEE","IEEE Conferences"
"A New Project Management Tool Based on DevSecOps","K. Zunnurhain; S. R. Duclervil","School of Computer Science, Kean University, Union, NJ, USA; School of Computer Science, Kean University, Union, NJ, USA","2019 International Conference on Computational Science and Computational Intelligence (CSCI)","20 Apr 2020","2019","","","239","243","Cyber Security has become an important and crucial part of our society. Software are many times developed with little to no guidelines and security components, costing the quality and security of the software. We investigated on different agile development life-cycle models including: Behavioral Driven Development, Scaled Agile Framework and DevOps and DevSecOps. Eventually, we decided to focus on the DevSecOps development life-cycle model. Different types of DevSecOps models were found and analyzed. The characteristics of each were gathered to develop criteria for a new and effective DevSecOps model. Our results show that the DevSecOps models were more reliable than the previous models. Hence we adapted this model to develop our website to allow more security. All the selected criteria are highlighted and discussed in this study along with the website.","","978-1-7281-5584-5","10.1109/CSCI49370.2019.00049","","https://ieeexplore.ieee.org/stamp/stamp.jsp?arnumber=9071258","Cyber Security, development models, scalability, DevOps, DevSecOps","Security;Software;Biological system modeling;Adaptation models;Tools;Project management;Analytical models","project management;security of data;software prototyping","scaled agile framework;DevSecOps development life-cycle model;cyber security;behavioral driven development;agile development life-cycle models;project management","","1","","5","","20 Apr 2020","","","IEEE","IEEE Conferences"
"Deep Neural Network Based Log Analysis","H. B. Ketmen; B. Bulut","Enforma Bilişim A.Ş.,İstanbul,Türkiye; Enforma Bilişim A.Ş.,İstanbul,Türkiye","2021 29th Signal Processing and Communications Applications Conference (SIU)","19 Jul 2021","2021","","","1","4","Today, the logs of the services running on virtual and real servers provide us with data from which statistical inferences can be made about the service itself and the ecosystem it is in, if it is analyzed. The usage purposes of the tools used in DevOps, the content of the logs they produce, the way they are stored and the frequency of reproduction may vary. Creating metrics by analyzing logs and taking necessary actions on metrics can potentially increase productivity when the hurdles such as fragmentation of unstructured data, processing of data and processing of data are overcome. In this study, it is shown that the logs can be modeled as a natural language sequence in order that the necessary actions be taken, and it is possible to classify the process logs of Jenkins, which is one of the services used in DevOps, by using the Bidirectional Long Short-Term Memory method, with high accuracy and Cohen's Kappa score.","2165-0608","978-1-6654-3649-6","10.1109/SIU53274.2021.9477836","","https://ieeexplore.ieee.org/stamp/stamp.jsp?arnumber=9477836","DevOps;Jenkins;log analysis;natural language sequence;Bidirectional Long Short Term Memory","Long short term memory;Conferences;Software;Measurement;Convolutional neural networks;Big Data;White spaces","convolutional neural nets;deep learning (artificial intelligence);information analysis;recurrent neural nets;system monitoring","deep neural network based log analysis;virtual servers;statistical inferences;DevOps;bidirectional long short-term memory method;Cohen Kappa score","","","","","","19 Jul 2021","","","IEEE","IEEE Conferences"
"Microservices for Continuous Deployment, Monitoring and Validation in Cyber-Physical Systems: an Industrial Case Study for Elevators Systems","A. Gartziandia; J. Ayerdi; A. Arrieta; S. Ali; T. Yue; A. Agirre; G. Sagardui; M. Arratibel",Ikerlan; Mondragon University; Mondragon University; Simula Research Laboratory; Simula Research Laboratory; Ikerlan; Mondragon University; Orona,"2021 IEEE 18th International Conference on Software Architecture Companion (ICSA-C)","10 May 2021","2021","","","46","53","Cyber-Physical Systems (CPSs) are systems that integrate digital cyber computations with physical processes. The software embedded in CPSs has a long life-cycle, requiring constant evolution to support new requirements, bug fixes, and deal with hardware obsolescence. To date, the development of software for CPSs is fragmented, which makes it extremely expensive. This could be substantially enhanced by tightly connecting the development and operation phases, as is done in other software engineering domains (e.g., web engineering through DevOps). Nevertheless, there are still complex issues that make it difficult to use DevOps techniques in the CPS domain, such as those related to hardware-software co-design. To pave the way towards DevOps in the CPS domain, in this paper we instantiate part of the reference architecture presented in the H2020 Adeptness project, which is based on microservices that allow for the continuous deployment, monitoring and validation of CPSs. To this end, we elaborate a systematic methodology that considers as input both domain expertise and a previously defined taxonomy for DevOps in the CPS domain. We obtain a generic microservice template that can be used in any kind of CPS. In addition, we instantiate this architecture in the context of an industrial case study from the elevation domain.","","978-1-6654-3910-7","10.1109/ICSA-C52384.2021.00014","","https://ieeexplore.ieee.org/stamp/stamp.jsp?arnumber=9425852","Microservices;DevOps;Cyber-Physical Systems","Systematics;Software architecture;Conferences;Taxonomy;Computer architecture;Cyber-physical systems;Software","cyber-physical systems;hardware-software codesign;lifts;production engineering computing;program debugging;service-oriented architecture","CPS domain;domain expertise;elevation domain;continuous deployment;cyber-physical systems;elevators systems;long life-cycle;hardware obsolescence;software engineering domains;DevOps techniques;hardware-software co-design;H2020 Adeptness project;generic microservice template;bug fixes;industrial case study","","","","23","","10 May 2021","","","IEEE","IEEE Conferences"
"Continuous Testing in the Development of IoT Applications","L. G. Guşeilă; D. Bratu; S. Moraru","Transilvania University of Braşov,Department of Automatics and Information Technology,Braşov,România; Transilvania University of Braşov,Department of Automatics and Information Technology,Braşov,România; Transilvania University of Braşov,Department of Automatics and Information Technology,Braşov,România","2019 International Conference on Sensing and Instrumentation in IoT Era (ISSI)","23 Mar 2020","2019","","","1","6","Internet-of-Things has evolved with the increased volume of data of interconnecting the physical world to the Internet. Cloud provides the underlying power for IoT to become a disrupting technology, revolutionizing the cloud, as we know it. IoT applications need to adapt frequently and rapidly to new requests. Increasing competition and rapidly changing market needs require from nowadays companies' flexibility and fast time to market of their products. To achieve these goals more and more organizations are relying on new IT technologies and software development processes. Though there are many publications around DevOps as a methodology and the use of a process for continuous integration and continuous development, there are fewer solutions provided which incorporate a software delivery pipeline incorporating all processes: continuous business planning, agile development, continuous integration, continuous deployment and continuous testing. The paper proposes a DevOps architecture and agile tools to be used in the implementation of a fully integrated DevOps pipeline based on open-source. Furthermore, continuous testing is covering test best practices and methods, which along with the DevOps pipeline can be widely implemented in any cloud environment, regardless of the cloud provider chosen.","","978-1-7281-1022-6","10.1109/ISSI47111.2019.9043692","","https://ieeexplore.ieee.org/stamp/stamp.jsp?arnumber=9043692","IoT;Cloud Computing;Agile Development;DevOps;Continuous Integration;Continuous Development;Continuous Testing;Automated Testing","","cloud computing;DP industry;Internet;Internet of Things;program testing;software engineering","continuous testing;IoT applications;Internet of Things applications;software development processes;continuous integration;continuous development;software delivery pipeline;continuous business planning;agile development;fully integrated DevOps pipeline;cloud environment;cloud provider","","1","","13","","23 Mar 2020","","","IEEE","IEEE Conferences"
"An Agile Software Development Life Cycle Model for Machine Learning Application Development","R. Ranawana; A. S. Karunananda","Enterprise Machine Learning (Pvt) ltd,Colombo,Sri Lanka; Department of Computational Mathematics,Moratuwa,Sri Lanka","2021 5th SLAAI International Conference on Artificial Intelligence (SLAAI-ICAI)","5 Jan 2022","2021","","","1","6","Software development teams are often hampered when aligning machine learning production with standard software development processes. Iterative experimentation is needed to address the inherent complexities of data collection and preparation, model entanglement, and the technical debt of machine learning. The complexity of this process is compounded due to dependencies on the production environment and real- time data. We propose a unified framework which facilitates the planning, development, and deployment of a machine learning application through parallel processes for software and machine learning engineering. This allows for the risk of both the project and machine learning development to be significantly reduced through continuous integration, evaluation, and production. The framework, named MLASDLC, unifies concepts from standard software development life cycle methodologies (SDLC), development operations (DevOps) and machine learning operations (MLOps) to present a framework for the development of machine learning applications.","","978-1-6654-0655-0","10.1109/SLAAI-ICAI54477.2021.9664736","","https://ieeexplore.ieee.org/stamp/stamp.jsp?arnumber=9664736","Machine learning;MLOps;DevOps;agile;SDLC;software development life cycle;experimentation;data-centric","Agile software development;Machine learning;Production;Data collection;Software;Data models;Complexity theory","computer aided instruction;learning (artificial intelligence);project management;software development management;software engineering;software prototyping;software quality","model entanglement;standard software development life cycle methodologies;development operations;agile software development life cycle model;machine learning application development;software development teams;aligning machine learning production;standard software development processes","","","","28","IEEE","5 Jan 2022","","","IEEE","IEEE Conferences"
"Enterprise-Driven Open Source Software: A Case Study on Security Automation","F. Angermeir; M. Voggenreiter; F. Moyón; D. Mendez","Technical University of Munich, Germany; Siemens Technology and Ludwig Maximilians University Munich, Germany; Siemens Technology and Technical University of Munich, Germany; Blekinge Institute of Technology and fortiss GmbH, Sweden and Germany","2021 IEEE/ACM 43rd International Conference on Software Engineering: Software Engineering in Practice (ICSE-SEIP)","7 May 2021","2021","","","278","287","Agile and DevOps are widely adopted by the industry. Hence, integrating security activities with industrial practices, such as continuous integration (CI) pipelines, is necessary to detect security flaws and adhere to regulators' demands early. In this paper, we analyze automated security activities in CI pipelines of enterprise-driven open source software (OSS). This shall allow us, in the long-run, to better understand the extent to which security activities are (or should be) part of automated pipelines. In particular, we mine publicly available OSS repositories and survey a sample of project maintainers to better understand the role that security activities and their related tools play in their CI pipelines. To increase transparency and allow other researchers to replicate our study (and to take different perspectives), we further disclose our research artefacts. Our results indicate that security activities in enterprise-driven OSS projects are scarce and protection coverage is rather low. Only 6.83% of the analyzed 8,243 projects apply security automation in their CI pipelines, even though maintainers consider security to be rather important. This alerts industry to keep the focus on vulnerabilities of 3rd Party software and it opens space for other improvements of practice which we outline in this manuscript.","","978-1-6654-3869-8","10.1109/ICSE-SEIP52600.2021.00037","","https://ieeexplore.ieee.org/stamp/stamp.jsp?arnumber=9402050","Security;Secure Software Engineering;Continuous Integration;Open Source Software;DevOps;DevSecOps","Industries;Automation;Pipelines;Tools;Security;Open source software;Software engineering","pipelines;public domain software;security of data;service-oriented architecture;software development management","enterprise-driven open source software;security automation;integrating security activities;continuous integration pipelines;security flaws;CI pipelines;automated pipelines;enterprise-driven OSS projects","","1","","30","","7 May 2021","","","IEEE","IEEE Conferences"
"Towards Continuous Delivery by Reducing the Feature Freeze Period: A Case Study","E. Laukkanen; M. Paasivaara; J. Itkonen; C. Lassenius; T. Arvonen","Dept. of Comput. Sci., Aalto Univ., Aalto, Finland; Dept. of Comput. Sci., Aalto Univ., Aalto, Finland; Dept. of Comput. Sci., Aalto Univ., Aalto, Finland; Dept. of Comput. Sci., Aalto Univ., Aalto, Finland; R&D Center Finland, Ericsson, Jorvas, Finland","2017 IEEE/ACM 39th International Conference on Software Engineering: Software Engineering in Practice Track (ICSE-SEIP)","3 Jul 2017","2017","","","23","32","Today, many software companies continuously deliver and deploy new features to their customers. However, many software systems are still released traditionally with long feature freeze periods and time-based releases due to historical reasons. Currently, only a few empirical inquiries of transformations towards continuous delivery exist. In this paper, we aim to understand how feature freeze was practiced and the feature freeze period reduced in an R&D program at Ericsson. The case organization has struggled with the feature freeze approach and is now moving towards the continuous delivery paradigm. We investigated the intended and actual effects of the feature freeze practice, how the feature freeze period was reduced and what effects the reduction had. We interviewed 11 employees, covering all the development teams at the largest site of the distributed organization. In addition, we analyzed data from software repositories to get quantitative triangulation of the qualitative results. Historically, the organization was not able to comply with the intended feature freeze practice, due to pressure for new feature development and long feature freeze periods leaving little time to perform actual development. By implementing test automation, the organization was able to reduce the feature freeze period by 56%, after which the amount of changes during the freeze decreased by 63% and the amount of changes close to the release date by 59%. We conclude that reducing the feature freeze period is possible using test automation, and reducing the freeze time can increase conformance to the intended feature freeze practice. To further reduce feature freeze, attention must be paid to deployment automation and collaboration between development and operations, in addition to test automation.","","978-1-5386-2717-4","10.1109/ICSE-SEIP.2017.21","","https://ieeexplore.ieee.org/stamp/stamp.jsp?arnumber=7965426","code freeze;feature freeze;release stabilization;continuous integration;continuous delivery;continuous deployment;devops;case study","Interviews;Automation;Companies;Testing;Software systems","organisational aspects;program testing;research and development","feature freeze period reduction;software companies;software systems;time-based releases;R&D program;Ericsson;case organization;continuous delivery paradigm;distributed organization;data analysis;software repositories;quantitative triangulation;feature development;test automation","","4","","14","","3 Jul 2017","","","IEEE","IEEE Conferences"
"Context-based analytics - establishing explicit links between runtime traces and source code","J. Cito; F. Oliveira; P. Leitner; P. Nagpurkar; H. C. Gall","Dept. of Inf., Univ. of Zurich, Zurich, Switzerland; IBM T.J. Watson Res. Center, Yorktown Heights, NY, USA; Dept. of Inf., Univ. of Zurich, Zurich, Switzerland; IBM T.J. Watson Res. Center, Yorktown Heights, NY, USA; Dept. of Inf., Univ. of Zurich, Zurich, Switzerland","2017 IEEE/ACM 39th International Conference on Software Engineering: Software Engineering in Practice Track (ICSE-SEIP)","24 Aug 2017","2017","","","193","202","Diagnosing problems in large-scale, distributed applications running in cloud environments requires investigating different sources of information to reason about application state at any given time. Typical sources of information available to developers and operators include log statements and other runtime information collected by monitors, such as application and system metrics. Just as importantly, developers rely on information related to changes to the source code and configuration files (program code) when troubleshooting. This information is generally scattered, and it is up to the troubleshooter to inspect multiple implicitly-connected fragments thereof. Currently, different tools need to be used in conjunction, e.g., log aggregation tools, source-code management tools, and runtime-metric dash boards, each requiring different data sources and workflows. Not surprisingly, diagnosing problems is a difficult proposition. In this paper, we propose Context-Based Analytics, an approach that makes the links between runtime information and program-code fragments explicit by constructing a graph based on an application-context model. Implicit connections between information fragments are explicitly represented as edges in the graph. We designed a framework for expressing application-context models and implemented a prototype. Further, we instantiated our prototype framework with an application-context model for two real cloud applications, one from IBM and another from a major telecommunications provider. We applied context-based analytics to diagnose two issues taken from the issue tracker of the IBM application and found that our approach reduced the effort of diagnosing these issues. In particular, context-based analytics decreased the number of required analysis steps by 48% and the number of needed inspected traces by 40% on average as compared to a standard diagnosis approach.","","978-1-5386-2717-4","10.1109/ICSE-SEIP.2017.1","","https://ieeexplore.ieee.org/stamp/stamp.jsp?arnumber=7965443","DevOps;Software Analytics;Runtime Information","Runtime;Context;Measurement;Context modeling;Tools;Software;Time series analysis","cloud computing;software engineering","context-based analytics;runtime traces;source code;cloud environments;program-code fragments;application-context models","","3","","32","","24 Aug 2017","","","IEEE","IEEE Conferences"
