"Design of Devops environment based on cloud platform architecture","J. Li; W. Li; X. Zhang; J. Duan; H. Wang","Information and Communication Branch of State Grid Corporation of China,Beijing,China; Information and Communication Branch of State Grid Corporation of China,Beijing,China; Information and Communication Branch of State Grid Corporation of China,Beijing,China; Information and Communication Branch of State Grid Corporation of China,Beijing,China; Information and Communication Branch of State Grid Corporation of China,Beijing,China","2022 IEEE 6th Information Technology and Mechatronics Engineering Conference (ITOEC)","23 Mar 2022","2022","6","","95","99","This paper designs a cloud-based R&D simulation environment construction method, builds an enterprise-level online DevOps system, opens up all aspects of R&D, testing, and production, realizes the online integration of the entire process of R&D, testing, and release, and improves the R&D and testing environment. Automated testing, automatic deployment capabilities, improved production environment “one-click release” capabilities, shortened the overall cycle of R&D and testing, explained the construction methods of unified code warehouse, dependent warehouse, and mirrored warehouse, realized centralized management of company code, and unified management of dependent warehouse version. Solve the problem of code leakage and reduce the risk of safe operation.","2693-289X","978-1-6654-3185-9","10.1109/ITOEC53115.2022.9734518","","https://ieeexplore.ieee.org/stamp/stamp.jsp?arnumber=9734518","R&D simulation environment;Integration;Devops;Cloud architecture","Codes;Mechatronics;Publishing;Conferences;Production;Companies;Maintenance engineering","","","","","","16","","23 Mar 2022","","","IEEE","IEEE Conferences"
"DevOps culture and its impact on cloud delivery and software development","M. Rajkumar; A. K. Pole; V. S. Adige; P. Mahanta","SAP Labs Pvt. Ltd., Bangalore, India; SAP Labs Pvt. Ltd., Bangalore, India; SAP Labs Pvt. Ltd., Bangalore, India; SAP Labs Pvt. Ltd., Bangalore, India","2016 International Conference on Advances in Computing, Communication, & Automation (ICACCA) (Spring)","29 Sep 2016","2016","","","1","6","DevOps presents a significant broader perspective in delivering software solutions. The perception of DevOps being a mere tool has been formulated into a change in culture, paradigms in automation, clarity in measuring risks and facilitating ease of sharing. DevOps has been responsible for companies to move from a monolithic pace of software releases to an agile mindset. This paper discovers the significance of DevOps and tries to explore the process of transformation from a legacy method and onto the impact of the change on overall architecture and software scale out. The transformation from a legacy mindset to agile mindset requires a formidable change to the organizational setup. The journey of adoption of such a culture requires various degrees of effort and techniques. In this paper, we cover the concepts, adoption strategies and the impact of such adoption strategies.","","978-1-5090-0673-1","10.1109/ICACCA.2016.7578902","","https://ieeexplore.ieee.org/stamp/stamp.jsp?arnumber=7578902","DevOps;Culture;Leadership;Agile","Software;Organizations;Engines;Computer architecture;Standards organizations;Production","cloud computing;software architecture;software prototyping","DevOps culture;cloud delivery;software development;software solutions;legacy method;legacy mindset;agile mindset;adoption strategies","","15","","14","","29 Sep 2016","","","IEEE","IEEE Conferences"
"DevOps for IoT Systems: Fast and Continuous Monitoring Feedback of System Availability","M. A. López-Peña; J. Díaz; J. E. Pérez; H. Humanes","Department of Innovation and Development, Sistemas Avanzados de Tecnología, S.A., Madrid, Spain; Departamento de Sistemas Informáticos, Universidad Politécnica de Madrid, Madrid, Spain; Departamento de Sistemas Informáticos, Universidad Politécnica de Madrid, Madrid, Spain; Department of Innovation and Development, Sistemas Avanzados de Tecnología, S.A., Madrid, Spain","IEEE Internet of Things Journal","9 Oct 2020","2020","7","10","10695","10707","Current Internet-of-Things (IoT) systems are highly distributed systems, which integrate cloud, fog, and edge computing approaches. Accelerating their maintenance and continuous improvement, while ensuring their availability, is complex. DevOps promotes fast and continuous feedback from operations to development to detect problems before customers are impacted, among other benefits. However, there is not any formal definition of how to do this. This article defines the “fast and continuous monitoring feedback of system availability” activity (F&CF availability) that supports automatic and continuous monitoring feedback from operations to the development of the IoT system availability. This activity has been formalized through the software and systems process engineering metamodel (SPEM). Its implementation is demonstrated in a real scenario that provides evidence that the formalization of the F&CF availability activity helps teams in better diagnosing and fixing outage problems. The result is a distributed and configurable monitoring component developed through code [monitoring as code (MaC)]. This component is embedded in the IoT infrastructure. MaC enables DevOps team to configure their own metrics and indicators at runtime, i.e., monitoring on demand. The formalization of this activity, based on an MaC technique, enables the automation, versioning, and replication of monitoring elements.","2327-4662","","10.1109/JIOT.2020.3012763","European Commission’s Horizon 2020 Research and Innovation Programme (RECAP, http://www.recapproject.eu)(grant numbers:732667); CROWDSAVING(grant numbers:TIN2016-79726-C2-1-R); ","https://ieeexplore.ieee.org/stamp/stamp.jsp?arnumber=9151987","Availability;continuous monitoring;DevOps;fast and continuous feedback activity;Internet-of-Things (IoT) systems","Monitoring;Task analysis;Internet of Things;Software;Telemetry;Maintenance engineering","cloud computing;Internet of Things;systems engineering","Internet-of-Things systems;edge computing approaches;automatic monitoring feedback;IoT system availability;F&CF availability activity;fixing outage problems;distributed monitoring component;configurable monitoring component;IoT infrastructure;monitoring elements;distributed systems;fog computing approaches;cloud computing approaches;DevOps;fast and continuous monitoring feedback of system availability activity;software and systems process engineering metamodel;SPEM;MaC technique","","7","","41","IEEE","29 Jul 2020","","","IEEE","IEEE Journals"
"Standards-Based DevOps Automation and Integration Using TOSCA","J. Wettinger; U. Breitenbücher; F. Leymann","Inst. of Archit. of Applic. Syst. (IAAS), Univ. of Stuttgart, Stuttgart, Germany; Inst. of Archit. of Applic. Syst. (IAAS), Univ. of Stuttgart, Stuttgart, Germany; Inst. of Archit. of Applic. Syst. (IAAS), Univ. of Stuttgart, Stuttgart, Germany","2014 IEEE/ACM 7th International Conference on Utility and Cloud Computing","2 Feb 2015","2014","","","59","68","DevOps is an emerging paradigm to tightly integrate developers with operations personnel. This is required to enable fast and frequent releases in the sense of continuously delivering software. Users and customers of today's Web applications and mobile apps running in the Cloud expect fast feedback to problems and feature requests. Thus, it is a critical competitive advantage to be able to respond quickly. Beside cultural and organizational changes that are necessary to implement DevOps in practice, tooling is required to implement end-to-end automation of deployment processes. Automation is the key to efficient collaboration and tight integration between development and operations. The DevOps community is constantly pushing new approaches, tools, and open-source artifacts to implement such automated processes. However, as all these proprietary and heterogeneous DevOps automation approaches differ from each other, it is hard to integrate and combine them to deploy applications in the Cloud. In this paper we present a systematic classification of DevOps artifacts and show how different kinds of artifacts can be transformed toward TOSCA, an emerging standard in this field. This enables the seamless and interoperable orchestration of arbitrary artifacts to model and deploy application topologies. We validate the presented approach by a prototype implementation, show its practical feasibility by a detailed case study, and evaluate its performance.","","978-1-4799-7881-6","10.1109/UCC.2014.14","","https://ieeexplore.ieee.org/stamp/stamp.jsp?arnumber=7027481","DevOps;Deployment Automation;Transformation;TOSCA;Chef;Juju;Cloud Standards;Cloud Computing","Servers;Automation;Topology;Databases;Communities;Runtime;Containers","cloud computing;formal specification","standards-based DevOps automation;TOSCA;cloud computing;topology and orchestration specification for cloud application","","46","2","35","","2 Feb 2015","","","IEEE","IEEE Conferences"
"Insights from SONATA: Implementing and integrating a microservice-based NFV service platform with a DevOps methodology","T. Soenen; S. Van Rossem; W. Tavernier; F. Vicens; D. Valocchi; P. Trakadas; P. Karkazis; G. Xilouris; P. Eardley; S. Kolometsos; M. -A. Kourtis; D. Guija; S. Siddiqui; P. Hasselmeyer; J. Bonnet; D. Lopez",Ghent University – imec; Ghent University – imec; Ghent University – imec; ATOS; University College London; Synelixis Solutions; Synelixis Solutions; NSCR Demokritos; BT; NSCR Demokritos; NSCR Demokritos; i2CAT Foundation Barcelona; i2CAT Foundation Barcelona; NEC Europe Ltd. Heidelberg; Altice Labs; Telefonica I+D,"NOMS 2018 - 2018 IEEE/IFIP Network Operations and Management Symposium","9 Jul 2018","2018","","","1","6","In pursuit of a flexible, resource efficient and high- performant 5G infrastructure, many operators, vendors and research consortia are currently developing, testing and inte­grating their NFV platform with associated management and orchestration (MANO) functionality. The SONATA NFV platform follows a micro-service design, which involves a tight coupling between an SDK, monitoring and MANO functionality, targeting a secure and stable software foundation. This experience paper gives a thorough overview on the encountered challenges, insights and resulting learnings when implementing and integrating the SONATA Service Platform using a continuous integration and delivery DevOps methodology. This is the result of a strong cooperation between prominent equipment vendors, network operators, software companies and universities, providing a set of constructive recommendations in hope of catalysing the development and deployment of NFV platforms.","2374-9709","978-1-5386-3416-5","10.1109/NOMS.2018.8406139","","https://ieeexplore.ieee.org/stamp/stamp.jsp?arnumber=8406139","","Monitoring;Task analysis;Measurement;5G mobile communication;Servers;Software;Tools","5G mobile communication;service-oriented architecture;software architecture;virtualisation","microservice-based NFV service platform;DevOps methodology;SONATA NFV platform;network function virtualization;SONATA service platform;software foundation;MANO functionality;associated management-orchestration functionality;high-performant 5G infrastructure;equipment vendors","","13","","15","","9 Jul 2018","","","IEEE","IEEE Conferences"
"Automated Capturing and Systematic Usage of DevOps Knowledge for Cloud Applications","J. Wettinger; V. Andrikopoulos; F. Leymann","Inst. of Archit. of Applic. Syst. (IAAS), Univ. of Stuttgart, Stuttgart, Germany; Inst. of Archit. of Applic. Syst. (IAAS), Univ. of Stuttgart, Stuttgart, Germany; Inst. of Archit. of Applic. Syst. (IAAS), Univ. of Stuttgart, Stuttgart, Germany","2015 IEEE International Conference on Cloud Engineering","23 Apr 2015","2015","","","60","65","DevOps is an emerging paradigm to actively foster the collaboration between system developers and operations in order to enable efficient end-to-end automation of software deployment and management processes. DevOps is typically combined with Cloud computing, which enables rapid, on-demand provisioning of underlying resources such as virtual servers, storage, or database instances using APIs in a self-service manner. Today, an ever-growing amount of DevOps tools, reusable artifacts such as scripts, and Cloud services are available to implement DevOps automation. Thus, informed decision making on the appropriate approach (es) for the needs of an application is hard. In this work we present a collaborative and holistic approach to capture DevOps knowledge in a knowledgebase. Beside the ability to capture expert knowledge and utilize crowd sourcing approaches, we implemented a crawling framework to automatically discover and capture DevOps knowledge. Moreover, we show how this knowledge is utilized to deploy and operate Cloud applications.","","978-1-4799-8218-9","10.1109/IC2E.2015.23","","https://ieeexplore.ieee.org/stamp/stamp.jsp?arnumber=7092900","DevOps;Crawling;Knowledge Management;Knowledge Model;Cloud Computing","Middleware;Servers;Databases;Knowledge engineering;Google;Engines;Collaboration","application program interfaces;cloud computing","systematic usage;automated capturing;DevOps knowledge;cloud applications;end-to-end automation;software deployment process;software management process;cloud computing;virtual servers;API;cloud services;knowledge base systems","","26","","15","","23 Apr 2015","","","IEEE","IEEE Conferences"
"From Agile to Continuous Development in the Healthcare Domain - Lessons Learned","W. Stocker","Siemens Healthineers, Forchheim, Germany","2018 IEEE/ACM 40th International Conference on Software Engineering: Software Engineering in Practice Track (ICSE-SEIP)","30 Aug 2018","2018","","","211","212","Starting in 2006 our organization in the healthcare domain began a shift towards agile-like development rather than a strict interpretation of the ""V-model"". But this was only the beginning of an ongoing journey. Today modern software engineering is characterized by much faster development cycles than those used in traditional models. Our business demands that we shorten release cycles and support many different deployment scenarios. Due to the nature of our products, it is also necessary to address the relevant regulatory requirements which make this task even more challenging. Over the years, we have made a number of improvements in the spirit of ""continuous improvement"" that have helped us reap the benefits of a more continuous way-of-working. These include organizational, architectural, and process-based improvements as well as explicitly focusing on the necessary culture in the organization. This experience report is a summary of our learnings and hopefully will provide something for everyone that helps on their own journey.","","978-1-4503-5659-6","","","https://ieeexplore.ieee.org/stamp/stamp.jsp?arnumber=8449252","Agile;Continuous Delivery;DevOps;Software Architecture;Best Practice Sharing;Software Engineering","Software;Software engineering;Computed tomography;Medical services;Computer architecture;Architecture;Organizations","health care;learning (artificial intelligence);organisational aspects;software development management;software engineering;software quality","continuous development;strict interpretation;V-model;ongoing journey;today modern software engineering;faster development cycles;relevant regulatory requirements;process-based improvements;healthcare domain","","","","0","","30 Aug 2018","","","IEEE","IEEE Conferences"
"To Transform to Have Agility, Dont Do a Capital A, Capital T Agile Transformation","J. Smart",Barclays,"IEEE Software","29 Nov 2018","2018","35","6","56","60","This article presents antipatterns (and the corresponding patterns) based on the author's experience implementing agility at Barclays. In recent years, enterprise -wide DevOps and agile at scale have surged. Compared to nearly 30 years of ""lightweight methodologies"" for team -level software development, this is a new field. DevOps emerged as a term in 2009, with scaled agile frameworks coming out comparatively recently: SAFe (Scaled Agile Framework) in 2011, Disciplined Agile in 2012, and LeSS (Large Scale Scrum) in 2013. However, relatively little research is available about these frameworks' effectiveness in practice, especially on an enterprise scale.","1937-4194","","10.1109/MS.2018.4321245","","https://ieeexplore.ieee.org/stamp/stamp.jsp?arnumber=8552621","agile transformation;agile development;agility;Barclays;DevOps;software engineering;software development;On DevOps","Software engineering;Software development;Agile software development","DP industry;project management;software development management;software prototyping;team working","agile transformation;enterprise-wide DevOps;team-level software development;agile frameworks;SAFe;Scaled Agile Framework;antipatterns","","4","","14","","29 Nov 2018","","","IEEE","IEEE Magazines"
"A DevOps Approach for Cyber-Physical System-of-Systems Engineering through Arrowhead","C. Hegedũs; P. Varga; A. Frankó","Budapest University of Technology and Economics, 2 Magyar Tudósok krt.,Dept. of Telecommunications and Media Informatics,Budapest,Hungary,H-1117; Budapest University of Technology and Economics, 2 Magyar Tudósok krt.,Dept. of Telecommunications and Media Informatics,Budapest,Hungary,H-1117; Industrial IoT Division, 48-50 Czetz János str,AITIA International Inc.,Budapest,Hungary,H-1039","2021 IFIP/IEEE International Symposium on Integrated Network Management (IM)","30 Jun 2021","2021","","","902","907","The stakeholders in the Cyber-Physical System-of-Systems (CPS, SoS, CPSoS) domains need to adopt current methodologies that enable reliable but also flexible and timely completion of development, integration, deployment, operation, and even maintenance-related tasks. The so-called DevOps (Development & Operations) approach has been proven in various other domains of IT-related service completion and operation. Both the technology set and the management approaches of CPS and SoS practitioners can benefit the adoption of the DevOps toolchain success stories - the everyday life of software, cloud and IT-service development, and operations-focused companies. This paper proposes an expansion of the application area of the DevOps models, toolchains, and even utilities to the CPS and SoS domains. It proposes to create an abstraction of CPS devices as reusable infrastructure resources, which can be then automatically re-purposed for new workflow tasks, as well as to fill the remaining DevOps tooling gaps with actual Systems of the Arrowhead Framework.","1573-0077","978-3-903176-32-4","","European Commission; ","https://ieeexplore.ieee.org/stamp/stamp.jsp?arnumber=9464069","","Companies;Software;Stakeholders;Reliability;Task analysis","cloud computing;cyber-physical systems;open systems;software engineering;systems engineering;systems of systems","DevOps approach;IT-related service completion;management approaches;DevOps toolchain success stories;IT-service development;operations-focused companies;CPS devices;cyber-physical system-of-systems engineering;development & operations approach;SoS practitioners;arrowhead framework","","","","37","","30 Jun 2021","","","IEEE","IEEE Conferences"
"Breaking down monoliths with Microservices and DevOps: an industrial experience report","D. Pianini; A. Neri","Alma Mater Studiorum—Università di Bologna,Cesena,Italy; Maggioli S.p.A. Santarcangelo di Romagna,Italy","2021 IEEE International Conference on Software Maintenance and Evolution (ICSME)","24 Nov 2021","2021","","","505","514","Recent trends in software production fostered the adoption of microservice architectures, where a product is the result of the coordinated execution of several loosely coupled autonomous services, thus promoting modularity, scalability, and integration of legacy products by wrapping. This architectural style also promotes parallel development, as different teams can be in charge of different services; however, this parallelization is at first sight at odds with the established practice of continuous integration: a change to a single service may cause cascading effects that the local testing cannot capture, and the overall functionality may thus get compromised even though all services apparently work. In this paper, we report an experience of a successful and thorough implementation of DevOps techniques into a large business, carried out by a relatively small team. We discuss the steps taken to build a continuous integration pipeline performing system-wide quality assurance, the development practices that enable such a pipeline to be effective, and the lessons learned by applying these practices in a digital publishing industry setting.","2576-3148","978-1-6654-2882-8","10.1109/ICSME52107.2021.00051","","https://ieeexplore.ieee.org/stamp/stamp.jsp?arnumber=9609206","Microservice architectures;DevOps;Continuous Integration;Parallel development;Distributed testing;Continuous delivery;Experience report","Software maintenance;Runtime environment;Quality assurance;Scalability;Pipelines;Production;Computer architecture","cloud computing;Internet;program testing;quality assurance;service-oriented architecture;software architecture;software prototyping;Web services","monoliths;Microservices;industrial experience report;software production;microservice architectures;coordinated execution;loosely coupled autonomous services;legacy products;wrapping;architectural style;parallel development;parallelization;odds;established practice;single service;cascading effects;local testing;successful implementation;thorough implementation;DevOps techniques;relatively small team;continuous integration pipeline;system-wide quality assurance;development practices;digital publishing industry setting","","","","29","","24 Nov 2021","","","IEEE","IEEE Conferences"
"Improving Digital Forensic Readiness in DevOps Context: Lessons Learned from XYZ Company","F. Gunawan; S. Yazid","Universitas Indonesia,Faculty of Computer Science,Jakarta,Indonesia; Universitas Indonesia,Faculty of Computer Science,Jakarta,Indonesia","2020 International Seminar on Application for Technology of Information and Communication (iSemantic)","26 Oct 2020","2020","","","459","463","DevOps is a relatively new methodology and culture in software development to deliver software faster and with higher quality. DevOps changes how an organization works by flattening structures, increasing collaboration, and also promotes automation. However, it might pose serious security problems if outsourcing, intellectual property, and data protection are not put into consideration. XYZ Company is a typical small software company that is transforming to embrace DevOps. Digital forensic is a post-mortem mechanism to analyze incidents to help organizations mitigate and doing lawsuits. Digital forensic readiness (DFR) is assessed using Elyas et al [3] DFR framework. DFR improvement is part of the company’s effort to maintain the security level. The method we took and the issues we faced in this transformation are shared in this report.","","978-1-7281-9068-6","10.1109/iSemantic50169.2020.9234194","","https://ieeexplore.ieee.org/stamp/stamp.jsp?arnumber=9234194","digital forensic;DevOps;software development;readiness","Training;Seminars;Digital forensics;Companies;Software;Knowledge management;Outsourcing","cloud computing;computer crime;cost reduction;digital forensics;organisational aspects;outsourcing","postmortem mechanism;DFR improvement;organizations;data protection;intellectual property;outsourcing property;serious security problems;flattening structures;software development;XYZ company;DevOps context;digital forensic readiness","","1","","27","","26 Oct 2020","","","IEEE","IEEE Conferences"
